{
  "type": "Rust",
  "build_dir": "build",
  "deploy_dir": "deploy",
  "contracts": {
    "root_dir": "contracts",
    "targets": {
      "ethereum" : {
        "files": [
            "./contracts/ERC20Bridged.sol"
        ]
      },
      "avalanche": {
        "files": [
            "./contracts/TokenSender.sol"
        ]
      }
    }
  },
  "network_profiles": {
      "default": {
          "ethereum": { "url": "http://localhost:8545" },
          "avalanche": { "url": "http://localhost:9545" }
      }
  }
}
